{
  "schema_version": "1.2.0",
  "authority_id": "authority-price-gate",
  "revision": 1,
  "active": true,
  "assignment_id": "assign-price-gate",
  "worker_id": "35",
  "owned_resources": ["contracts/price-a.json", "contracts/price-b.json", "contracts/price-c.json"],
  "forbidden_resources": ["contracts/index.json"],
  "shared_entrypoints": ["contracts/index.json"],
  "stop_conditions": ["Stop on authority digest mismatch"],
  "manifest_digest": "sha256:2dc6b0c155858a1e8114aac2a5f0bcc0daa0413ed61ad2ac92d0c0f7eec99834"
}
